{
  "schemaVersion": 2,
  "name": "js-ts",
  "description": "Version-aware JavaScript fixture",
  "detects": ["package.json"],
  "sensors": {
    "lint": {
      "applicability": { "allFiles": ["package.json"] },
      "variants": [{
        "id": "eslint-10-flat", "priority": 100,
        "requirements": { "tool": "eslint", "toolRange": ">=10.0.0 <11.0.0", "runtime": "node", "runtimeRange": ">=20.19.0" },
        "certifiedRange": ">=10.0.0 <11.0.0",
        "command": { "executable": "eslint", "resolution": "node-modules-bin", "args": [".", "--config", "eslint.config.awm.mjs"] },
        "assets": ["eslint.config.awm.mjs"], "formatter": "eslint-llm", "probe": { "kind": "eslint-print-config" }
      }]
    }
  },
  "coverage": {
    "schemaVersion": 1,
    "classes": {
      "lint-errors": {
        "description": "Lint rule violations", "detectors": [{ "sensor": "lint" }],
        "remedy": { "summary": "Configure lint", "command": "awm sensors init --pack js-ts" }
      }
    }
  }
}
